{
  "$schema": "https://json-schema.org/draft/2020-12/schema",
  "$id": "https://example.invalid/schemas/reader-surface-semantic-review-v2.schema.json",
  "title": "Survey Production Core v2 Pre-Publication Reader-Surface Semantic Review Record",
  "type": "object",
  "additionalProperties": false,
  "required": [
    "schema_version",
    "issue_id",
    "publication_profile",
    "review_kind",
    "reviewed_surface",
    "checks",
    "decision",
    "reviewed_by",
    "reviewed_at",
    "findings",
    "review_sha256"
  ],
  "properties": {
    "schema_version": {"const": "2.0-rc1"},
    "issue_id": {"type": "string", "minLength": 1},
    "publication_profile": {"enum": ["WEEKLY_MAGAZINE", "LONGFORM_SPECIAL"]},
    "review_kind": {"const": "SEMANTIC_EDITORIAL"},
    "reviewed_surface": {
      "type": "object",
      "additionalProperties": false,
      "required": ["path", "sha256"],
      "properties": {
        "path": {"type": "string", "minLength": 1},
        "sha256": {"$ref": "#/$defs/sha256"}
      }
    },
    "checks": {
      "type": "array",
      "minItems": 1,
      "items": {
        "type": "object",
        "additionalProperties": false,
        "required": [
          "check_id",
          "status",
          "detail",
          "evidence_locations"
        ],
        "properties": {
          "check_id": {"type": "string", "minLength": 1},
          "status": {"enum": ["PASS", "FAIL"]},
          "detail": {"type": "string", "minLength": 1},
          "evidence_locations": {
            "type": "array",
            "minItems": 1,
            "items": {"type": "string", "minLength": 1}
          }
        }
      }
    },
    "decision": {"enum": ["PASS", "FAIL"]},
    "reviewed_by": {"type": "string", "minLength": 1},
    "reviewed_at": {"type": "string", "format": "date-time"},
    "recorded_at": {"type": "string", "format": "date-time"},
    "status": {"enum": ["PASSED", "FAILED"]},
    "findings": {
      "type": "array",
      "items": {
        "type": "object",
        "additionalProperties": false,
        "required": [
          "finding_id",
          "locator",
          "text_span",
          "severity",
          "reason",
          "proposed_normalization",
          "disposition"
        ],
        "properties": {
          "finding_id": {"type": "string", "minLength": 1},
          "rule_id": {"type": "string", "minLength": 1},
          "artifact": {"type": "string", "minLength": 1},
          "path": {"type": "string", "minLength": 1},
          "field_or_block": {"type": "string", "minLength": 1},
          "locator": {"type": "string", "minLength": 1},
          "text_span": {"type": "string"},
          "severity": {"enum": ["BLOCKING", "WARNING", "INFO", "SUPPRESSED"]},
          "reason": {"type": "string", "minLength": 1},
          "proposed_normalization": {"type": "string"},
          "disposition": {"enum": ["UNRESOLVED", "SUPPRESSED", "NORMALIZED", "RESOLVED"]}
        }
      }
    },
    "summary": {"type": "string"},
    "editorial_correction_scope": {
      "type": "object",
      "additionalProperties": false,
      "required": [
        "version",
        "decision",
        "before_reader_input",
        "preserved_upstream_sha256",
        "change_summary",
        "evidence_locations"
      ],
      "properties": {
        "version": {"const": "EDITORIAL_CORRECTION_SCOPE_V1"},
        "decision": {"enum": ["WITHIN_APPROVED_AUTHORITY", "REQUIRES_OWNER_DECISION", "REJECT"]},
        "before_reader_input": {
          "type": "object",
          "additionalProperties": false,
          "required": ["path", "sha256"],
          "properties": {
            "path": {"type": "string", "minLength": 1},
            "sha256": {"$ref": "#/$defs/sha256"}
          }
        },
        "preserved_upstream_sha256": {"$ref": "#/$defs/sha256"},
        "change_summary": {"type": "string", "minLength": 1},
        "evidence_locations": {
          "type": "array",
          "minItems": 1,
          "items": {"type": "string", "minLength": 1}
        }
      }
    },
    "review_sha256": {"$ref": "#/$defs/sha256"}
  },
  "$defs": {
    "sha256": {"type": "string", "pattern": "^[0-9a-f]{64}$"}
  }
}
