{
  "checks": [
    {
      "check_id": "READER_PIPELINE_INDEPENDENCE",
      "detail": "Synthetic fixture review (depth-boundary-v2-wrongrole-v2): prose is independently understandable without internal pipeline knowledge. EXPLICITLY NONGENUINE fixture judgment, never a genuine approval.",
      "evidence_locations": [
        "reader-surface-input-v2.json:cover"
      ],
      "status": "PASS"
    }
  ],
  "decision": "PASS",
  "findings": [],
  "issue_id": "2026-W33",
  "publication_profile": "WEEKLY_MAGAZINE",
  "review_kind": "SEMANTIC_EDITORIAL",
  "review_sha256": "09cfbd9cda3e17e5e71e54b3155d6df35c2775637c04ad0984ee0644cc172450",
  "reviewed_at": "2026-10-28T06:00:00Z",
  "reviewed_by": "SYNTHETIC_FIXTURE_REVIEWER_GENERAL_FULL_V2",
  "reviewed_surface": {
    "path": "sources/2026-W33/publication/v2/reader-surface-input-v2.json",
    "sha256": "27ffe9571c333b3888f7684aeab29aab2f7d38e5b07d32737cc570d81565ade3"
  },
  "schema_version": "2.0-rc1",
  "status": "PASSED",
  "summary": "Synthetic pre-TeX semantic review (depth-boundary-v2-wrongrole-v2); explicitly nongenuine"
}
